<?xml version="1.0" encoding="UTF-8"?>
<!--<!DOCTYPE pedido SYSTEM "Ejercicio1_2.dtd">-->
<pedido xmlns:xsi="http://www.w3.org/2001/XMLSchema-instance" xsi:noNamespaceSchemaLocation="Ejercicio1_2_Schema.xsd">
    <nombre_cliente>Nazaret</nombre_cliente>
    <direccion_entrega>C/Luna Nº2</direccion_entrega>
    <productos>
        <producto numero_produto = "2">
            <nombre>Hamburguesa</nombre>
            <precio>6€</precio>
        </producto>
        <producto numero_produto = "1">
            <nombre>Queso</nombre>
            <precio>0.50€</precio>
        </producto>
        <producto numero_produto = "3">
            <nombre>Cebolla</nombre>
            <precio>0.70€</precio>
        </producto>
    </productos>
</pedido>